{
  "document_type": "timeline",
  "locale": "zh-CN",
  "meta": {
    "title": "Momo Platform 2025 产品路线图",
    "subtitle": "从基础设施升级到 AI 驱动的智能平台",
    "eyebrow": "Momo Paper / timeline / zh-CN"
  },
  "sections": {
    "milestones": [
      {
        "date": "2025 Q1",
        "title": "基础设施升级完成",
        "description": "Kubernetes 集群迁移完成，CI/CD 流水线重构",
        "status": "completed"
      },
      {
        "date": "2025 Q2",
        "title": "实时协作功能上线",
        "description": "支持多人同时编辑、评论与光标跟踪",
        "status": "in_progress"
      },
      {
        "date": "2025 Q3",
        "title": "AI 助手全面集成",
        "description": "智能续写、润色、翻译、摘要功能全面开放",
        "status": "upcoming"
      },
      {
        "date": "2025 Q4",
        "title": "企业版发布",
        "description": "SSO、审计日志、高级权限管理、私有化部署",
        "status": "upcoming"
      }
    ],
    "phases": [
      {
        "name": "第一阶段：夯实基础",
        "period": "Q1",
        "description": "完成技术债务清理和基础设施升级，为后续功能开发打好基础。"
      },
      {
        "name": "第二阶段：协同升级",
        "period": "Q2",
        "description": "推出实时协作功能，提升团队协同效率。"
      },
      {
        "name": "第三阶段：AI 赋能",
        "period": "Q3",
        "description": "集成大语言模型能力，让 AI 成为用户的写作助手。"
      },
      {
        "name": "第四阶段：企业就绪",
        "period": "Q4",
        "description": "推出企业版功能，满足大型团队的合规与管控需求。"
      }
    ],
    "next_steps": {
      "body": [
        "Q2 的核心目标是确保实时协作功能稳定上线。当前进度 60%，剩余工作包括：WebSocket 连接稳定性优化、冲突解决算法完善。"
      ]
    }
  }
}
